{'ID': 123, 'infectedStatus': 'infected', 'orderNo': 1, 'packet': 'tcpdump: verbose output suppressed, use -v[v]... for full protocol decode\n'}
{'ID': 123, 'infectedStatus': 'healthy', 'orderNo': 1, 'packet': 'tcpdump: verbose output suppressed, use -v[v]... for full protocol decode\n'}
{'ID': 123, 'infectedStatus': 'infected', 'orderNo': 2, 'packet': 'listening on br-cedfe51a6ca4, link-type EN10MB (Ethernet), snapshot length 262144 bytes\n'}
{'ID': 123, 'infectedStatus': 'healthy', 'orderNo': 2, 'packet': 'listening on br-3e5b56b3ee66, link-type EN10MB (Ethernet), snapshot length 262144 bytes\n'}
{'ID': 123, 'infectedStatus': 'infected', 'orderNo': 3, 'packet': '18:07:20.638952 IP AdipositasThe4th.mdns > 224.0.0.251.mdns: 0 [2q] [2n] ANY (QM)? 1.96.168.192.in-addr.arpa. ANY (QM)? AdipositasThe4th.local. (101)\n'}
{'ID': 123, 'infectedStatus': 'infected', 'orderNo': 4, 'packet': '18:07:20.839083 IP AdipositasThe4th.mdns > 224.0.0.251.mdns: 0*- [0q] 2/0/0 (Cache flush) PTR AdipositasThe4th.local., (Cache flush) A 192.168.96.1 (89)\n'}
{'ID': 123, 'infectedStatus': 'infected', 'orderNo': 5, 'packet': '18:07:20.919323 IP AdipositasThe4th > igmp.mcast.net: igmp v3 report, 2 group record(s)\n'}
{'ID': 123, 'infectedStatus': 'infected', 'orderNo': 6, 'packet': '18:07:20.955243 IP6 :: > ff02::16: HBH ICMP6, multicast listener report v2, 2 group record(s), length 48\n'}
{'ID': 123, 'infectedStatus': 'infected', 'orderNo': 7, 'packet': '18:07:20.994645 IP AdipositasThe4th.mdns > 224.0.0.251.mdns: 0 [10q] PTR (QM)? _nfs._tcp.local. PTR (QM)? _pgpkey-hkp._tcp.local. PTR (QM)? _ipp._tcp.local. PTR (QM)? _ipps._tcp.local. PTR (QM)? _ftp._tcp.local. PTR (QM)? _webdav._tcp.local. PTR (QM)? _webdavs._tcp.local. PTR (QM)? _sftp-ssh._tcp.local. PTR (QM)? _smb._tcp.local. PTR (QM)? _afpovertcp._tcp.local. (159)\n'}
{'ID': 123, 'infectedStatus': 'infected', 'orderNo': 8, 'packet': '18:07:21.111242 IP6 :: > ff02::1:ff76:82c9: ICMP6, neighbor solicitation, who has AdipositasThe4th, length 32\n'}
{'ID': 123, 'infectedStatus': 'infected', 'orderNo': 9, 'packet': '18:07:22.032861 IP AdipositasThe4th.mdns > 224.0.0.251.mdns: 0*- [0q] 2/0/0 (Cache flush) PTR AdipositasThe4th.local., (Cache flush) A 192.168.96.1 (89)\n'}
{'ID': 123, 'infectedStatus': 'infected', 'orderNo': 10, 'packet': '18:07:22.135367 IP6 AdipositasThe4th > ff02::16: HBH ICMP6, multicast listener report v2, 2 group record(s), length 48\n'}
{'ID': 123, 'infectedStatus': 'infected', 'orderNo': 11, 'packet': '18:07:22.151225 IP6 AdipositasThe4th > ff02::16: HBH ICMP6, multicast listener report v2, 1 group record(s), length 28\n'}
{'ID': 123, 'infectedStatus': 'infected', 'orderNo': 12, 'packet': '18:07:22.237682 IP6 AdipositasThe4th.mdns > ff02::fb.mdns: 0 [10q] PTR (QM)? _nfs._tcp.local. PTR (QM)? _pgpkey-hkp._tcp.local. PTR (QM)? _ipp._tcp.local. PTR (QM)? _ipps._tcp.local. PTR (QM)? _ftp._tcp.local. PTR (QM)? _webdav._tcp.local. PTR (QM)? _webdavs._tcp.local. PTR (QM)? _sftp-ssh._tcp.local. PTR (QM)? _smb._tcp.local. PTR (QM)? _afpovertcp._tcp.local. (159)\n'}
{'ID': 123, 'infectedStatus': 'infected', 'orderNo': 13, 'packet': '18:07:22.381055 IP6 AdipositasThe4th.mdns > ff02::fb.mdns: 0 [2q] [2n] ANY (QM)? 9.c.2.8.6.7.e.f.f.f.7.3.2.4.0.0.0.0.0.0.0.0.0.0.0.0.0.0.0.8.e.f.ip6.arpa. ANY (QM)? AdipositasThe4th.local. (160)\n'}
{'ID': 123, 'infectedStatus': 'infected', 'orderNo': 14, 'packet': '18:07:22.381250 IP AdipositasThe4th.mdns > 224.0.0.251.mdns: 0 [2q] [2n] ANY (QM)? 9.c.2.8.6.7.e.f.f.f.7.3.2.4.0.0.0.0.0.0.0.0.0.0.0.0.0.0.0.8.e.f.ip6.arpa. ANY (QM)? AdipositasThe4th.local. (160)\n'}
{'ID': 123, 'infectedStatus': 'infected', 'orderNo': 15, 'packet': '18:07:22.455395 IP6 AdipositasThe4th > ff02::16: HBH ICMP6, multicast listener report v2, 3 group record(s), length 68\n'}
{'ID': 123, 'infectedStatus': 'infected', 'orderNo': 16, 'packet': '18:07:22.631825 IP6 AdipositasThe4th.mdns > ff02::fb.mdns: 0 [2q] [2n] ANY (QM)? 9.c.2.8.6.7.e.f.f.f.7.3.2.4.0.0.0.0.0.0.0.0.0.0.0.0.0.0.0.8.e.f.ip6.arpa. ANY (QM)? AdipositasThe4th.local. (160)\n'}
{'ID': 123, 'infectedStatus': 'infected', 'orderNo': 17, 'packet': '18:07:22.632002 IP AdipositasThe4th.mdns > 224.0.0.251.mdns: 0 [2q] [2n] ANY (QM)? 9.c.2.8.6.7.e.f.f.f.7.3.2.4.0.0.0.0.0.0.0.0.0.0.0.0.0.0.0.8.e.f.ip6.arpa. ANY (QM)? AdipositasThe4th.local. (160)\n'}
{'ID': 123, 'infectedStatus': 'infected', 'orderNo': 18, 'packet': '18:07:22.632224 IP AdipositasThe4th.mdns > 224.0.0.251.mdns: 0*- [0q] 1/0/0 (Cache flush) A 192.168.96.1 (50)\n'}
{'ID': 123, 'infectedStatus': 'infected', 'orderNo': 19, 'packet': '18:07:22.775412 IP6 AdipositasThe4th > ff02::16: HBH ICMP6, multicast listener report v2, 1 group record(s), length 28\n'}
{'ID': 123, 'infectedStatus': 'infected', 'orderNo': 20, 'packet': '18:07:22.882686 IP6 AdipositasThe4th.mdns > ff02::fb.mdns: 0 [2q] [2n] ANY (QM)? 9.c.2.8.6.7.e.f.f.f.7.3.2.4.0.0.0.0.0.0.0.0.0.0.0.0.0.0.0.8.e.f.ip6.arpa. ANY (QM)? AdipositasThe4th.local. (160)\n'}
{'ID': 123, 'infectedStatus': 'infected', 'orderNo': 21, 'packet': '18:07:22.882796 IP AdipositasThe4th.mdns > 224.0.0.251.mdns: 0 [2q] [2n] ANY (QM)? 9.c.2.8.6.7.e.f.f.f.7.3.2.4.0.0.0.0.0.0.0.0.0.0.0.0.0.0.0.8.e.f.ip6.arpa. ANY (QM)? AdipositasThe4th.local. (160)\n'}
{'ID': 123, 'infectedStatus': 'infected', 'orderNo': 22, 'packet': '18:07:22.995750 IP AdipositasThe4th.mdns > 224.0.0.251.mdns: 0 [10q] PTR (QM)? _nfs._tcp.local. PTR (QM)? _pgpkey-hkp._tcp.local. PTR (QM)? _ipp._tcp.local. PTR (QM)? _ipps._tcp.local. PTR (QM)? _ftp._tcp.local. PTR (QM)? _webdav._tcp.local. PTR (QM)? _webdavs._tcp.local. PTR (QM)? _sftp-ssh._tcp.local. PTR (QM)? _smb._tcp.local. PTR (QM)? _afpovertcp._tcp.local. (159)\n'}
{'ID': 123, 'infectedStatus': 'infected', 'orderNo': 23, 'packet': '18:07:23.083628 IP AdipositasThe4th.mdns > 224.0.0.251.mdns: 0*- [0q] 2/0/0 (Cache flush) PTR AdipositasThe4th.local., (Cache flush) AAAA fe80::42:37ff:fe76:82c9 (148)\n'}
{'ID': 123, 'infectedStatus': 'infected', 'orderNo': 24, 'packet': '18:07:23.083770 IP6 AdipositasThe4th.mdns > ff02::fb.mdns: 0*- [0q] 2/0/0 (Cache flush) PTR AdipositasThe4th.local., (Cache flush) AAAA fe80::42:37ff:fe76:82c9 (148)\n'}
{'ID': 123, 'infectedStatus': 'healthy', 'orderNo': 3, 'packet': '18:07:20.663322 IP6 AdipositasThe4th > ff02::16: HBH ICMP6, multicast listener report v2, 2 group record(s), length 48\n'}
{'ID': 123, 'infectedStatus': 'healthy', 'orderNo': 4, 'packet': '18:07:20.675266 IP6 AdipositasThe4th > ff02::16: HBH ICMP6, multicast listener report v2, 1 group record(s), length 28\n'}
{'ID': 123, 'infectedStatus': 'healthy', 'orderNo': 5, 'packet': '18:07:20.763681 IP6 AdipositasThe4th.mdns > ff02::fb.mdns: 0 [10q] PTR (QM)? _nfs._tcp.local. PTR (QM)? _pgpkey-hkp._tcp.local. PTR (QM)? _ipp._tcp.local. PTR (QM)? _ipps._tcp.local. PTR (QM)? _ftp._tcp.local. PTR (QM)? _webdav._tcp.local. PTR (QM)? _webdavs._tcp.local. PTR (QM)? _sftp-ssh._tcp.local. PTR (QM)? _smb._tcp.local. PTR (QM)? _afpovertcp._tcp.local. (159)\n'}
{'ID': 123, 'infectedStatus': 'healthy', 'orderNo': 6, 'packet': '18:07:20.907561 IP6 AdipositasThe4th.mdns > ff02::fb.mdns: 0 [2q] [2n] ANY (QM)? 3.3.6.5.1.0.e.f.f.f.8.0.2.4.0.0.0.0.0.0.0.0.0.0.0.0.0.0.0.8.e.f.ip6.arpa. ANY (QM)? AdipositasThe4th.local. (160)\n'}
{'ID': 123, 'infectedStatus': 'healthy', 'orderNo': 7, 'packet': '18:07:20.907638 IP AdipositasThe4th.mdns > 224.0.0.251.mdns: 0 [2q] [2n] ANY (QM)? 3.3.6.5.1.0.e.f.f.f.8.0.2.4.0.0.0.0.0.0.0.0.0.0.0.0.0.0.0.8.e.f.ip6.arpa. ANY (QM)? AdipositasThe4th.local. (160)\n'}
{'ID': 123, 'infectedStatus': 'healthy', 'orderNo': 8, 'packet': '18:07:20.907716 IP AdipositasThe4th.mdns > 224.0.0.251.mdns: 0*- [0q] 1/0/0 (Cache flush) A 192.168.80.1 (50)\n'}
{'ID': 123, 'infectedStatus': 'healthy', 'orderNo': 9, 'packet': '18:07:21.015225 IP6 AdipositasThe4th > ff02::16: HBH ICMP6, multicast listener report v2, 1 group record(s), length 28\n'}
{'ID': 123, 'infectedStatus': 'healthy', 'orderNo': 10, 'packet': '18:07:21.157784 IP6 AdipositasThe4th.mdns > ff02::fb.mdns: 0 [2q] [2n] ANY (QM)? 3.3.6.5.1.0.e.f.f.f.8.0.2.4.0.0.0.0.0.0.0.0.0.0.0.0.0.0.0.8.e.f.ip6.arpa. ANY (QM)? AdipositasThe4th.local. (160)\n'}
{'ID': 123, 'infectedStatus': 'healthy', 'orderNo': 11, 'packet': '18:07:21.157865 IP AdipositasThe4th.mdns > 224.0.0.251.mdns: 0 [2q] [2n] ANY (QM)? 3.3.6.5.1.0.e.f.f.f.8.0.2.4.0.0.0.0.0.0.0.0.0.0.0.0.0.0.0.8.e.f.ip6.arpa. ANY (QM)? AdipositasThe4th.local. (160)\n'}
{'ID': 123, 'infectedStatus': 'healthy', 'orderNo': 12, 'packet': '18:07:21.202392 IP AdipositasThe4th.mdns > 224.0.0.251.mdns: 0*- [0q] 1/0/0 (Cache flush) PTR AdipositasThe4th.local. (73)\n'}
{'ID': 123, 'infectedStatus': 'healthy', 'orderNo': 13, 'packet': '18:07:21.408331 IP6 AdipositasThe4th.mdns > ff02::fb.mdns: 0 [2q] [2n] ANY (QM)? 3.3.6.5.1.0.e.f.f.f.8.0.2.4.0.0.0.0.0.0.0.0.0.0.0.0.0.0.0.8.e.f.ip6.arpa. ANY (QM)? AdipositasThe4th.local. (160)\n'}
{'ID': 123, 'infectedStatus': 'healthy', 'orderNo': 14, 'packet': '18:07:21.408461 IP AdipositasThe4th.mdns > 224.0.0.251.mdns: 0 [2q] [2n] ANY (QM)? 3.3.6.5.1.0.e.f.f.f.8.0.2.4.0.0.0.0.0.0.0.0.0.0.0.0.0.0.0.8.e.f.ip6.arpa. ANY (QM)? AdipositasThe4th.local. (160)\n'}
{'ID': 123, 'infectedStatus': 'healthy', 'orderNo': 15, 'packet': '18:07:21.408646 IP AdipositasThe4th.mdns > 224.0.0.251.mdns: 0*- [0q] 1/0/0 (Cache flush) A 192.168.80.1 (50)\n'}
{'ID': 123, 'infectedStatus': 'healthy', 'orderNo': 16, 'packet': '18:07:21.591244 IP6 AdipositasThe4th > ff02::16: HBH ICMP6, multicast listener report v2, 3 group record(s), length 68\n'}
{'ID': 123, 'infectedStatus': 'healthy', 'orderNo': 17, 'packet': '18:07:21.609118 IP AdipositasThe4th.mdns > 224.0.0.251.mdns: 0*- [0q] 2/0/0 (Cache flush) PTR AdipositasThe4th.local., (Cache flush) AAAA fe80::42:8ff:fe01:5633 (148)\n'}
{'ID': 123, 'infectedStatus': 'healthy', 'orderNo': 18, 'packet': '18:07:21.609183 IP6 AdipositasThe4th.mdns > ff02::fb.mdns: 0*- [0q] 2/0/0 (Cache flush) PTR AdipositasThe4th.local., (Cache flush) AAAA fe80::42:8ff:fe01:5633 (148)\n'}
{'ID': 123, 'infectedStatus': 'healthy', 'orderNo': 19, 'packet': '18:07:21.764881 IP6 AdipositasThe4th.mdns > ff02::fb.mdns: 0 [10q] PTR (QM)? _nfs._tcp.local. PTR (QM)? _pgpkey-hkp._tcp.local. PTR (QM)? _ipp._tcp.local. PTR (QM)? _ipps._tcp.local. PTR (QM)? _ftp._tcp.local. PTR (QM)? _webdav._tcp.local. PTR (QM)? _webdavs._tcp.local. PTR (QM)? _sftp-ssh._tcp.local. PTR (QM)? _smb._tcp.local. PTR (QM)? _afpovertcp._tcp.local. (159)\n'}
{'ID': 123, 'infectedStatus': 'healthy', 'orderNo': 20, 'packet': '18:07:22.165244 IP AdipositasThe4th.mdns > 224.0.0.251.mdns: 0 [10q] PTR (QM)? _nfs._tcp.local. PTR (QM)? _pgpkey-hkp._tcp.local. PTR (QM)? _ipp._tcp.local. PTR (QM)? _ipps._tcp.local. PTR (QM)? _ftp._tcp.local. PTR (QM)? _webdav._tcp.local. PTR (QM)? _webdavs._tcp.local. PTR (QM)? _sftp-ssh._tcp.local. PTR (QM)? _smb._tcp.local. PTR (QM)? _afpovertcp._tcp.local. (159)\n'}
{'ID': 123, 'infectedStatus': 'healthy', 'orderNo': 21, 'packet': '18:07:22.802989 IP AdipositasThe4th.mdns > 224.0.0.251.mdns: 0*- [0q] 2/0/0 (Cache flush) PTR AdipositasThe4th.local., (Cache flush) AAAA fe80::42:8ff:fe01:5633 (148)\n'}
{'ID': 123, 'infectedStatus': 'healthy', 'orderNo': 22, 'packet': '18:07:22.803143 IP6 AdipositasThe4th.mdns > ff02::fb.mdns: 0*- [0q] 2/0/0 (Cache flush) PTR AdipositasThe4th.local., (Cache flush) AAAA fe80::42:8ff:fe01:5633 (148)\n'}
{'ID': 123, 'infectedStatus': 'healthy', 'orderNo': 23, 'packet': '18:07:23.395680 IP AdipositasThe4th.mdns > 224.0.0.251.mdns: 0*- [0q] 2/0/0 (Cache flush) PTR AdipositasThe4th.local., (Cache flush) A 192.168.80.1 (89)\n'}
{'ID': 123, 'infectedStatus': 'infected', 'orderNo': 25, 'packet': '18:07:23.238268 IP6 AdipositasThe4th.mdns > ff02::fb.mdns: 0 [10q] PTR (QM)? _nfs._tcp.local. PTR (QM)? _pgpkey-hkp._tcp.local. PTR (QM)? _ipp._tcp.local. PTR (QM)? _ipps._tcp.local. PTR (QM)? _ftp._tcp.local. PTR (QM)? _webdav._tcp.local. PTR (QM)? _webdavs._tcp.local. PTR (QM)? _sftp-ssh._tcp.local. PTR (QM)? _smb._tcp.local. PTR (QM)? _afpovertcp._tcp.local. (159)\n'}
{'ID': 123, 'infectedStatus': 'infected', 'orderNo': 26, 'packet': '18:07:24.204571 IP AdipositasThe4th.53202 > 239.255.255.250.1900: UDP, length 173\n'}
{'ID': 123, 'infectedStatus': 'infected', 'orderNo': 27, 'packet': '18:07:24.226424 IP AdipositasThe4th.mdns > 224.0.0.251.mdns: 0*- [0q] 2/0/0 (Cache flush) PTR AdipositasThe4th.local., (Cache flush) A 192.168.96.1 (89)\n'}
{'ID': 123, 'infectedStatus': 'infected', 'orderNo': 28, 'packet': '18:07:24.276997 IP AdipositasThe4th.mdns > 224.0.0.251.mdns: 0*- [0q] 2/0/0 (Cache flush) PTR AdipositasThe4th.local., (Cache flush) AAAA fe80::42:37ff:fe76:82c9 (148)\n'}
{'ID': 123, 'infectedStatus': 'infected', 'orderNo': 29, 'packet': '18:07:24.277160 IP6 AdipositasThe4th.mdns > ff02::fb.mdns: 0*- [0q] 2/0/0 (Cache flush) PTR AdipositasThe4th.local., (Cache flush) AAAA fe80::42:37ff:fe76:82c9 (148)\n'}
{'ID': 123, 'infectedStatus': 'infected', 'orderNo': 30, 'packet': '18:07:25.205749 IP AdipositasThe4th.53202 > 239.255.255.250.1900: UDP, length 173\n'}
{'ID': 123, 'infectedStatus': 'infected', 'orderNo': 31, 'packet': '18:07:25.238348 IP6 AdipositasThe4th.mdns > ff02::fb.mdns: 0 [10q] PTR (QM)? _nfs._tcp.local. PTR (QM)? _pgpkey-hkp._tcp.local. PTR (QM)? _ipp._tcp.local. PTR (QM)? _ipps._tcp.local. PTR (QM)? _ftp._tcp.local. PTR (QM)? _webdav._tcp.local. PTR (QM)? _webdavs._tcp.local. PTR (QM)? _sftp-ssh._tcp.local. PTR (QM)? _smb._tcp.local. PTR (QM)? _afpovertcp._tcp.local. (159)\n'}
{'ID': 123, 'infectedStatus': 'infected', 'orderNo': 32, 'packet': '18:07:26.206017 IP AdipositasThe4th.53202 > 239.255.255.250.1900: UDP, length 173\n'}
{'ID': 123, 'infectedStatus': 'infected', 'orderNo': 33, 'packet': '18:07:26.470371 IP AdipositasThe4th.mdns > 224.0.0.251.mdns: 0*- [0q] 2/0/0 (Cache flush) PTR AdipositasThe4th.local., (Cache flush) AAAA fe80::42:37ff:fe76:82c9 (148)\n'}
{'ID': 123, 'infectedStatus': 'infected', 'orderNo': 34, 'packet': '18:07:26.470557 IP6 AdipositasThe4th.mdns > ff02::fb.mdns: 0*- [0q] 2/0/0 (Cache flush) PTR AdipositasThe4th.local., (Cache flush) AAAA fe80::42:37ff:fe76:82c9 (148)\n'}
{'ID': 123, 'infectedStatus': 'infected', 'orderNo': 35, 'packet': '18:07:26.997075 IP AdipositasThe4th.mdns > 224.0.0.251.mdns: 0 [10q] PTR (QM)? _nfs._tcp.local. PTR (QM)? _pgpkey-hkp._tcp.local. PTR (QM)? _ipp._tcp.local. PTR (QM)? _ipps._tcp.local. PTR (QM)? _ftp._tcp.local. PTR (QM)? _webdav._tcp.local. PTR (QM)? _webdavs._tcp.local. PTR (QM)? _sftp-ssh._tcp.local. PTR (QM)? _smb._tcp.local. PTR (QM)? _afpovertcp._tcp.local. (159)\n'}
{'ID': 123, 'infectedStatus': 'infected', 'orderNo': 36, 'packet': '18:07:27.204996 IP AdipositasThe4th.mdns > 224.0.0.251.mdns: 0 PTR (QM)? _googlecast._tcp.local. (40)\n'}
{'ID': 123, 'infectedStatus': 'infected', 'orderNo': 37, 'packet': '18:07:27.205235 IP AdipositasThe4th.mdns > 224.0.0.251.mdns: 0 PTR (QM)? _googlecast._tcp.local. (40)\n'}
{'ID': 123, 'infectedStatus': 'infected', 'orderNo': 38, 'packet': '18:07:27.206492 IP AdipositasThe4th.53202 > 239.255.255.250.1900: UDP, length 173\n'}
{'ID': 123, 'infectedStatus': 'infected', 'orderNo': 39, 'packet': '18:07:28.206135 IP AdipositasThe4th.mdns > 224.0.0.251.mdns: 0 PTR (QM)? _googlecast._tcp.local. (40)\n'}
{'ID': 123, 'infectedStatus': 'infected', 'orderNo': 40, 'packet': '18:07:28.206336 IP AdipositasThe4th.mdns > 224.0.0.251.mdns: 0 PTR (QM)? _googlecast._tcp.local. (40)\n'}
{'ID': 123, 'infectedStatus': 'infected', 'orderNo': 41, 'packet': '18:07:29.240435 IP6 AdipositasThe4th.mdns > ff02::fb.mdns: 0 [10q] PTR (QM)? _nfs._tcp.local. PTR (QM)? _pgpkey-hkp._tcp.local. PTR (QM)? _ipp._tcp.local. PTR (QM)? _ipps._tcp.local. PTR (QM)? _ftp._tcp.local. PTR (QM)? _webdav._tcp.local. PTR (QM)? _webdavs._tcp.local. PTR (QM)? _sftp-ssh._tcp.local. PTR (QM)? _smb._tcp.local. PTR (QM)? _afpovertcp._tcp.local. (159)\n'}
{'ID': 123, 'infectedStatus': 'infected', 'orderNo': 42, 'packet': '18:07:30.206981 IP AdipositasThe4th.mdns > 224.0.0.251.mdns: 0 PTR (QM)? _googlecast._tcp.local. (40)\n'}
{'ID': 123, 'infectedStatus': 'infected', 'orderNo': 43, 'packet': '18:07:30.207247 IP AdipositasThe4th.mdns > 224.0.0.251.mdns: 0 PTR (QM)? _googlecast._tcp.local. (40)\n'}
{'ID': 123, 'infectedStatus': 'infected', 'orderNo': 44, 'packet': '18:07:34.997699 IP AdipositasThe4th.mdns > 224.0.0.251.mdns: 0 [10q] PTR (QM)? _nfs._tcp.local. PTR (QM)? _pgpkey-hkp._tcp.local. PTR (QM)? _ipp._tcp.local. PTR (QM)? _ipps._tcp.local. PTR (QM)? _ftp._tcp.local. PTR (QM)? _webdav._tcp.local. PTR (QM)? _webdavs._tcp.local. PTR (QM)? _sftp-ssh._tcp.local. PTR (QM)? _smb._tcp.local. PTR (QM)? _afpovertcp._tcp.local. (159)\n'}
{'ID': 123, 'infectedStatus': 'infected', 'orderNo': 45, 'packet': '18:07:37.241657 IP6 AdipositasThe4th.mdns > ff02::fb.mdns: 0 [10q] PTR (QM)? _nfs._tcp.local. PTR (QM)? _pgpkey-hkp._tcp.local. PTR (QM)? _ipp._tcp.local. PTR (QM)? _ipps._tcp.local. PTR (QM)? _ftp._tcp.local. PTR (QM)? _webdav._tcp.local. PTR (QM)? _webdavs._tcp.local. PTR (QM)? _sftp-ssh._tcp.local. PTR (QM)? _smb._tcp.local. PTR (QM)? _afpovertcp._tcp.local. (159)\n'}
{'ID': 123, 'infectedStatus': 'healthy', 'orderNo': 24, 'packet': '18:07:23.765261 IP6 AdipositasThe4th.mdns > ff02::fb.mdns: 0 [10q] PTR (QM)? _nfs._tcp.local. PTR (QM)? _pgpkey-hkp._tcp.local. PTR (QM)? _ipp._tcp.local. PTR (QM)? _ipps._tcp.local. PTR (QM)? _ftp._tcp.local. PTR (QM)? _webdav._tcp.local. PTR (QM)? _webdavs._tcp.local. PTR (QM)? _sftp-ssh._tcp.local. PTR (QM)? _smb._tcp.local. PTR (QM)? _afpovertcp._tcp.local. (159)\n'}
{'ID': 123, 'infectedStatus': 'healthy', 'orderNo': 25, 'packet': '18:07:24.204532 IP AdipositasThe4th.44137 > 239.255.255.250.1900: UDP, length 173\n'}
{'ID': 123, 'infectedStatus': 'healthy', 'orderNo': 26, 'packet': '18:07:24.997012 IP AdipositasThe4th.mdns > 224.0.0.251.mdns: 0*- [0q] 2/0/0 (Cache flush) PTR AdipositasThe4th.local., (Cache flush) AAAA fe80::42:8ff:fe01:5633 (148)\n'}
{'ID': 123, 'infectedStatus': 'healthy', 'orderNo': 27, 'packet': '18:07:24.997213 IP6 AdipositasThe4th.mdns > ff02::fb.mdns: 0*- [0q] 2/0/0 (Cache flush) PTR AdipositasThe4th.local., (Cache flush) AAAA fe80::42:8ff:fe01:5633 (148)\n'}
{'ID': 123, 'infectedStatus': 'healthy', 'orderNo': 28, 'packet': '18:07:25.205711 IP AdipositasThe4th.44137 > 239.255.255.250.1900: UDP, length 173\n'}
{'ID': 123, 'infectedStatus': 'healthy', 'orderNo': 29, 'packet': '18:07:26.165528 IP AdipositasThe4th.mdns > 224.0.0.251.mdns: 0 [10q] PTR (QM)? _nfs._tcp.local. PTR (QM)? _pgpkey-hkp._tcp.local. PTR (QM)? _ipp._tcp.local. PTR (QM)? _ipps._tcp.local. PTR (QM)? _ftp._tcp.local. PTR (QM)? _webdav._tcp.local. PTR (QM)? _webdavs._tcp.local. PTR (QM)? _sftp-ssh._tcp.local. PTR (QM)? _smb._tcp.local. PTR (QM)? _afpovertcp._tcp.local. (159)\n'}
{'ID': 123, 'infectedStatus': 'healthy', 'orderNo': 30, 'packet': '18:07:26.205978 IP AdipositasThe4th.44137 > 239.255.255.250.1900: UDP, length 173\n'}
{'ID': 123, 'infectedStatus': 'healthy', 'orderNo': 31, 'packet': '18:07:27.204948 IP AdipositasThe4th.mdns > 224.0.0.251.mdns: 0 PTR (QM)? _googlecast._tcp.local. (40)\n'}
{'ID': 123, 'infectedStatus': 'healthy', 'orderNo': 32, 'packet': '18:07:27.205210 IP AdipositasThe4th.mdns > 224.0.0.251.mdns: 0 PTR (QM)? _googlecast._tcp.local. (40)\n'}
{'ID': 123, 'infectedStatus': 'healthy', 'orderNo': 33, 'packet': '18:07:27.206475 IP AdipositasThe4th.44137 > 239.255.255.250.1900: UDP, length 173\n'}
{'ID': 123, 'infectedStatus': 'healthy', 'orderNo': 34, 'packet': '18:07:27.766574 IP6 AdipositasThe4th.mdns > ff02::fb.mdns: 0 [10q] PTR (QM)? _nfs._tcp.local. PTR (QM)? _pgpkey-hkp._tcp.local. PTR (QM)? _ipp._tcp.local. PTR (QM)? _ipps._tcp.local. PTR (QM)? _ftp._tcp.local. PTR (QM)? _webdav._tcp.local. PTR (QM)? _webdavs._tcp.local. PTR (QM)? _sftp-ssh._tcp.local. PTR (QM)? _smb._tcp.local. PTR (QM)? _afpovertcp._tcp.local. (159)\n'}
{'ID': 123, 'infectedStatus': 'healthy', 'orderNo': 35, 'packet': '18:07:28.206085 IP AdipositasThe4th.mdns > 224.0.0.251.mdns: 0 PTR (QM)? _googlecast._tcp.local. (40)\n'}
{'ID': 123, 'infectedStatus': 'healthy', 'orderNo': 36, 'packet': '18:07:28.206310 IP AdipositasThe4th.mdns > 224.0.0.251.mdns: 0 PTR (QM)? _googlecast._tcp.local. (40)\n'}
{'ID': 123, 'infectedStatus': 'healthy', 'orderNo': 37, 'packet': '18:07:30.206918 IP AdipositasThe4th.mdns > 224.0.0.251.mdns: 0 PTR (QM)? _googlecast._tcp.local. (40)\n'}
{'ID': 123, 'infectedStatus': 'healthy', 'orderNo': 38, 'packet': '18:07:30.207175 IP AdipositasThe4th.mdns > 224.0.0.251.mdns: 0 PTR (QM)? _googlecast._tcp.local. (40)\n'}
{'ID': 123, 'infectedStatus': 'healthy', 'orderNo': 39, 'packet': '18:07:34.169259 IP AdipositasThe4th.mdns > 224.0.0.251.mdns: 0 [10q] PTR (QM)? _nfs._tcp.local. PTR (QM)? _pgpkey-hkp._tcp.local. PTR (QM)? _ipp._tcp.local. PTR (QM)? _ipps._tcp.local. PTR (QM)? _ftp._tcp.local. PTR (QM)? _webdav._tcp.local. PTR (QM)? _webdavs._tcp.local. PTR (QM)? _sftp-ssh._tcp.local. PTR (QM)? _smb._tcp.local. PTR (QM)? _afpovertcp._tcp.local. (159)\n'}
{'ID': 123, 'infectedStatus': 'healthy', 'orderNo': 40, 'packet': '18:07:35.766868 IP6 AdipositasThe4th.mdns > ff02::fb.mdns: 0 [10q] PTR (QM)? _nfs._tcp.local. PTR (QM)? _pgpkey-hkp._tcp.local. PTR (QM)? _ipp._tcp.local. PTR (QM)? _ipps._tcp.local. PTR (QM)? _ftp._tcp.local. PTR (QM)? _webdav._tcp.local. PTR (QM)? _webdavs._tcp.local. PTR (QM)? _sftp-ssh._tcp.local. PTR (QM)? _smb._tcp.local. PTR (QM)? _afpovertcp._tcp.local. (159)\n'}
{'ID': 123, 'infectedStatus': 'healthy', 'orderNo': 41, 'packet': '18:07:50.179693 IP AdipositasThe4th.mdns > 224.0.0.251.mdns: 0 [10q] PTR (QM)? _nfs._tcp.local. PTR (QM)? _pgpkey-hkp._tcp.local. PTR (QM)? _ipp._tcp.local. PTR (QM)? _ipps._tcp.local. PTR (QM)? _ftp._tcp.local. PTR (QM)? _webdav._tcp.local. PTR (QM)? _webdavs._tcp.local. PTR (QM)? _sftp-ssh._tcp.local. PTR (QM)? _smb._tcp.local. PTR (QM)? _afpovertcp._tcp.local. (159)\n'}
{'ID': 123, 'infectedStatus': 'healthy', 'orderNo': 42, 'packet': '18:07:51.767526 IP6 AdipositasThe4th.mdns > ff02::fb.mdns: 0 [10q] PTR (QM)? _nfs._tcp.local. PTR (QM)? _pgpkey-hkp._tcp.local. PTR (QM)? _ipp._tcp.local. PTR (QM)? _ipps._tcp.local. PTR (QM)? _ftp._tcp.local. PTR (QM)? _webdav._tcp.local. PTR (QM)? _webdavs._tcp.local. PTR (QM)? _sftp-ssh._tcp.local. PTR (QM)? _smb._tcp.local. PTR (QM)? _afpovertcp._tcp.local. (159)\n'}
{'ID': 123, 'infectedStatus': 'healthy', 'orderNo': 43, 'packet': '18:08:22.207884 IP AdipositasThe4th.mdns > 224.0.0.251.mdns: 0 [10q] PTR (QM)? _nfs._tcp.local. PTR (QM)? _pgpkey-hkp._tcp.local. PTR (QM)? _ipp._tcp.local. PTR (QM)? _ipps._tcp.local. PTR (QM)? _ftp._tcp.local. PTR (QM)? _webdav._tcp.local. PTR (QM)? _webdavs._tcp.local. PTR (QM)? _sftp-ssh._tcp.local. PTR (QM)? _smb._tcp.local. PTR (QM)? _afpovertcp._tcp.local. (159)\n'}
{'ID': 123, 'infectedStatus': 'infected', 'orderNo': 1, 'packet': 'tcpdump: verbose output suppressed, use -v[v]... for full protocol decode\n'}
{'ID': 123, 'infectedStatus': 'healthy', 'orderNo': 1, 'packet': 'tcpdump: verbose output suppressed, use -v[v]... for full protocol decode\n'}
{'ID': 123, 'infectedStatus': 'healthy', 'orderNo': 2, 'packet': 'listening on br-b8cb618e5236, link-type EN10MB (Ethernet), snapshot length 262144 bytes\n'}
{'ID': 123, 'infectedStatus': 'infected', 'orderNo': 2, 'packet': 'listening on br-30c8c3f7ece6, link-type EN10MB (Ethernet), snapshot length 262144 bytes\n'}
{'ID': 123, 'infectedStatus': 'infected', 'orderNo': 3, 'packet': '18:10:55.707223 IP AdipositasThe4th > igmp.mcast.net: igmp v3 report, 2 group record(s)\n'}
{'ID': 123, 'infectedStatus': 'healthy', 'orderNo': 3, 'packet': '18:10:56.100225 IP AdipositasThe4th.mdns > 224.0.0.251.mdns: 0*- [0q] 2/0/0 (Cache flush) PTR AdipositasThe4th.local., (Cache flush) A 192.168.128.1 (90)\n'}
{'ID': 123, 'infectedStatus': 'infected', 'orderNo': 4, 'packet': '18:10:55.802380 IP AdipositasThe4th.mdns > 224.0.0.251.mdns: 0*- [0q] 2/0/0 (Cache flush) PTR AdipositasThe4th.local., (Cache flush) A 192.168.144.1 (90)\n'}
{'ID': 123, 'infectedStatus': 'healthy', 'orderNo': 4, 'packet': '18:10:56.453051 IP AdipositasThe4th.mdns > 224.0.0.251.mdns: 0 PTR (QM)? _googlecast._tcp.local. (40)\n'}
{'ID': 123, 'infectedStatus': 'healthy', 'orderNo': 5, 'packet': '18:10:56.453154 IP AdipositasThe4th.mdns > 224.0.0.251.mdns: 0 PTR (QM)? _googlecast._tcp.local. (40)\n'}
{'ID': 123, 'infectedStatus': 'infected', 'orderNo': 5, 'packet': '18:10:55.863273 IP6 :: > ff02::16: HBH ICMP6, multicast listener report v2, 2 group record(s), length 48\n'}
{'ID': 123, 'infectedStatus': 'infected', 'orderNo': 6, 'packet': '18:10:56.074966 IP AdipositasThe4th.mdns > 224.0.0.251.mdns: 0 [10q] PTR (QM)? _nfs._tcp.local. PTR (QM)? _pgpkey-hkp._tcp.local. PTR (QM)? _ipp._tcp.local. PTR (QM)? _ipps._tcp.local. PTR (QM)? _ftp._tcp.local. PTR (QM)? _webdav._tcp.local. PTR (QM)? _webdavs._tcp.local. PTR (QM)? _sftp-ssh._tcp.local. PTR (QM)? _smb._tcp.local. PTR (QM)? _afpovertcp._tcp.local. (159)\n'}
{'ID': 123, 'infectedStatus': 'healthy', 'orderNo': 6, 'packet': '18:10:56.539513 IP6 AdipositasThe4th > ff02::16: HBH ICMP6, multicast listener report v2, 2 group record(s), length 48\n'}
{'ID': 123, 'infectedStatus': 'infected', 'orderNo': 7, 'packet': '18:10:56.453072 IP AdipositasThe4th.mdns > 224.0.0.251.mdns: 0 PTR (QM)? _googlecast._tcp.local. (40)\n'}
{'ID': 123, 'infectedStatus': 'healthy', 'orderNo': 7, 'packet': '18:10:56.551336 IP6 AdipositasThe4th > ff02::16: HBH ICMP6, multicast listener report v2, 1 group record(s), length 28\n'}
{'ID': 123, 'infectedStatus': 'infected', 'orderNo': 8, 'packet': '18:10:56.453163 IP AdipositasThe4th.mdns > 224.0.0.251.mdns: 0 PTR (QM)? _googlecast._tcp.local. (40)\n'}
{'ID': 123, 'infectedStatus': 'healthy', 'orderNo': 8, 'packet': '18:10:56.640669 IP6 AdipositasThe4th.mdns > ff02::fb.mdns: 0 [10q] PTR (QM)? _nfs._tcp.local. PTR (QM)? _pgpkey-hkp._tcp.local. PTR (QM)? _ipp._tcp.local. PTR (QM)? _ipps._tcp.local. PTR (QM)? _ftp._tcp.local. PTR (QM)? _webdav._tcp.local. PTR (QM)? _webdavs._tcp.local. PTR (QM)? _sftp-ssh._tcp.local. PTR (QM)? _smb._tcp.local. PTR (QM)? _afpovertcp._tcp.local. (159)\n'}
{'ID': 123, 'infectedStatus': 'infected', 'orderNo': 9, 'packet': '18:10:56.471353 IP6 AdipositasThe4th > ff02::16: HBH ICMP6, multicast listener report v2, 2 group record(s), length 48\n'}
{'ID': 123, 'infectedStatus': 'healthy', 'orderNo': 9, 'packet': '18:10:56.666597 IP6 AdipositasThe4th.mdns > ff02::fb.mdns: 0 [2q] [2n] ANY (QM)? d.e.4.4.7.8.e.f.f.f.8.6.2.4.0.0.0.0.0.0.0.0.0.0.0.0.0.0.0.8.e.f.ip6.arpa. ANY (QM)? AdipositasThe4th.local. (160)\n'}
{'ID': 123, 'infectedStatus': 'infected', 'orderNo': 10, 'packet': '18:10:56.483248 IP6 AdipositasThe4th > ff02::16: HBH ICMP6, multicast listener report v2, 1 group record(s), length 28\n'}
{'ID': 123, 'infectedStatus': 'healthy', 'orderNo': 10, 'packet': '18:10:56.666646 IP AdipositasThe4th.mdns > 224.0.0.251.mdns: 0 [2q] [2n] ANY (QM)? d.e.4.4.7.8.e.f.f.f.8.6.2.4.0.0.0.0.0.0.0.0.0.0.0.0.0.0.0.8.e.f.ip6.arpa. ANY (QM)? AdipositasThe4th.local. (160)\n'}
{'ID': 123, 'infectedStatus': 'infected', 'orderNo': 11, 'packet': '18:10:56.573466 IP6 AdipositasThe4th.mdns > ff02::fb.mdns: 0 [10q] PTR (QM)? _nfs._tcp.local. PTR (QM)? _pgpkey-hkp._tcp.local. PTR (QM)? _ipp._tcp.local. PTR (QM)? _ipps._tcp.local. PTR (QM)? _ftp._tcp.local. PTR (QM)? _webdav._tcp.local. PTR (QM)? _webdavs._tcp.local. PTR (QM)? _sftp-ssh._tcp.local. PTR (QM)? _smb._tcp.local. PTR (QM)? _afpovertcp._tcp.local. (159)\n'}
{'ID': 123, 'infectedStatus': 'healthy', 'orderNo': 11, 'packet': '18:10:56.666726 IP AdipositasThe4th.mdns > 224.0.0.251.mdns: 0*- [0q] 1/0/0 (Cache flush) A 192.168.128.1 (50)\n'}
{'ID': 123, 'infectedStatus': 'infected', 'orderNo': 12, 'packet': '18:10:56.599835 IP6 AdipositasThe4th.mdns > ff02::fb.mdns: 0 [2q] [2n] ANY (QM)? 4.6.9.6.5.0.e.f.f.f.7.6.2.4.0.0.0.0.0.0.0.0.0.0.0.0.0.0.0.8.e.f.ip6.arpa. ANY (QM)? AdipositasThe4th.local. (160)\n'}
{'ID': 123, 'infectedStatus': 'healthy', 'orderNo': 12, 'packet': '18:10:56.917182 IP6 AdipositasThe4th.mdns > ff02::fb.mdns: 0 [2q] [2n] ANY (QM)? d.e.4.4.7.8.e.f.f.f.8.6.2.4.0.0.0.0.0.0.0.0.0.0.0.0.0.0.0.8.e.f.ip6.arpa. ANY (QM)? AdipositasThe4th.local. (160)\n'}
{'ID': 123, 'infectedStatus': 'infected', 'orderNo': 13, 'packet': '18:10:56.599972 IP AdipositasThe4th.mdns > 224.0.0.251.mdns: 0 [2q] [2n] ANY (QM)? 4.6.9.6.5.0.e.f.f.f.7.6.2.4.0.0.0.0.0.0.0.0.0.0.0.0.0.0.0.8.e.f.ip6.arpa. ANY (QM)? AdipositasThe4th.local. (160)\n'}
{'ID': 123, 'infectedStatus': 'infected', 'orderNo': 14, 'packet': '18:10:56.600147 IP AdipositasThe4th.mdns > 224.0.0.251.mdns: 0*- [0q] 1/0/0 (Cache flush) A 192.168.144.1 (50)\n'}
{'ID': 123, 'infectedStatus': 'healthy', 'orderNo': 13, 'packet': '18:10:56.917264 IP AdipositasThe4th.mdns > 224.0.0.251.mdns: 0 [2q] [2n] ANY (QM)? d.e.4.4.7.8.e.f.f.f.8.6.2.4.0.0.0.0.0.0.0.0.0.0.0.0.0.0.0.8.e.f.ip6.arpa. ANY (QM)? AdipositasThe4th.local. (160)\n'}
{'ID': 123, 'infectedStatus': 'infected', 'orderNo': 15, 'packet': '18:10:56.823217 IP6 AdipositasThe4th > ff02::16: HBH ICMP6, multicast listener report v2, 3 group record(s), length 68\n'}
{'ID': 123, 'infectedStatus': 'healthy', 'orderNo': 14, 'packet': '18:10:57.047223 IP6 AdipositasThe4th > ff02::16: HBH ICMP6, multicast listener report v2, 1 group record(s), length 28\n'}
{'ID': 123, 'infectedStatus': 'infected', 'orderNo': 16, 'packet': '18:10:56.850186 IP6 AdipositasThe4th.mdns > ff02::fb.mdns: 0 [2q] [2n] ANY (QM)? 4.6.9.6.5.0.e.f.f.f.7.6.2.4.0.0.0.0.0.0.0.0.0.0.0.0.0.0.0.8.e.f.ip6.arpa. ANY (QM)? AdipositasThe4th.local. (160)\n'}
{'ID': 123, 'infectedStatus': 'healthy', 'orderNo': 15, 'packet': '18:10:57.168108 IP6 AdipositasThe4th.mdns > ff02::fb.mdns: 0 [2q] [2n] ANY (QM)? d.e.4.4.7.8.e.f.f.f.8.6.2.4.0.0.0.0.0.0.0.0.0.0.0.0.0.0.0.8.e.f.ip6.arpa. ANY (QM)? AdipositasThe4th.local. (160)\n'}
{'ID': 123, 'infectedStatus': 'infected', 'orderNo': 17, 'packet': '18:10:56.850262 IP AdipositasThe4th.mdns > 224.0.0.251.mdns: 0 [2q] [2n] ANY (QM)? 4.6.9.6.5.0.e.f.f.f.7.6.2.4.0.0.0.0.0.0.0.0.0.0.0.0.0.0.0.8.e.f.ip6.arpa. ANY (QM)? AdipositasThe4th.local. (160)\n'}
{'ID': 123, 'infectedStatus': 'infected', 'orderNo': 18, 'packet': '18:10:56.878804 IP AdipositasThe4th.mdns > 224.0.0.251.mdns: 0*- [0q] 1/0/0 (Cache flush) PTR AdipositasThe4th.local. (74)\n'}
{'ID': 123, 'infectedStatus': 'healthy', 'orderNo': 16, 'packet': '18:10:57.168192 IP AdipositasThe4th.mdns > 224.0.0.251.mdns: 0 [2q] [2n] ANY (QM)? d.e.4.4.7.8.e.f.f.f.8.6.2.4.0.0.0.0.0.0.0.0.0.0.0.0.0.0.0.8.e.f.ip6.arpa. ANY (QM)? AdipositasThe4th.local. (160)\n'}
{'ID': 123, 'infectedStatus': 'infected', 'orderNo': 19, 'packet': '18:10:57.100366 IP6 AdipositasThe4th.mdns > ff02::fb.mdns: 0 [2q] [2n] ANY (QM)? 4.6.9.6.5.0.e.f.f.f.7.6.2.4.0.0.0.0.0.0.0.0.0.0.0.0.0.0.0.8.e.f.ip6.arpa. ANY (QM)? AdipositasThe4th.local. (160)\n'}
{'ID': 123, 'infectedStatus': 'healthy', 'orderNo': 17, 'packet': '18:10:57.168292 IP AdipositasThe4th.mdns > 224.0.0.251.mdns: 0*- [0q] 1/0/0 (Cache flush) A 192.168.128.1 (50)\n'}
{'ID': 123, 'infectedStatus': 'infected', 'orderNo': 20, 'packet': '18:10:57.100428 IP AdipositasThe4th.mdns > 224.0.0.251.mdns: 0 [2q] [2n] ANY (QM)? 4.6.9.6.5.0.e.f.f.f.7.6.2.4.0.0.0.0.0.0.0.0.0.0.0.0.0.0.0.8.e.f.ip6.arpa. ANY (QM)? AdipositasThe4th.local. (160)\n'}
{'ID': 123, 'infectedStatus': 'healthy', 'orderNo': 18, 'packet': '18:10:57.299396 IP AdipositasThe4th.mdns > 224.0.0.251.mdns: 0 [10q] PTR (QM)? _nfs._tcp.local. PTR (QM)? _pgpkey-hkp._tcp.local. PTR (QM)? _ipp._tcp.local. PTR (QM)? _ipps._tcp.local. PTR (QM)? _ftp._tcp.local. PTR (QM)? _webdav._tcp.local. PTR (QM)? _webdavs._tcp.local. PTR (QM)? _sftp-ssh._tcp.local. PTR (QM)? _smb._tcp.local. PTR (QM)? _afpovertcp._tcp.local. (159)\n'}
{'ID': 123, 'infectedStatus': 'infected', 'orderNo': 21, 'packet': '18:10:57.100511 IP AdipositasThe4th.mdns > 224.0.0.251.mdns: 0*- [0q] 1/0/0 (Cache flush) A 192.168.144.1 (50)\n'}
{'ID': 123, 'infectedStatus': 'healthy', 'orderNo': 19, 'packet': '18:10:57.368093 IP AdipositasThe4th.mdns > 224.0.0.251.mdns: 0*- [0q] 2/0/0 (Cache flush) PTR AdipositasThe4th.local., (Cache flush) AAAA fe80::42:68ff:fe87:44ed (148)\n'}
{'ID': 123, 'infectedStatus': 'infected', 'orderNo': 22, 'packet': '18:10:57.143222 IP6 AdipositasThe4th > ff02::16: HBH ICMP6, multicast listener report v2, 1 group record(s), length 28\n'}
{'ID': 123, 'infectedStatus': 'healthy', 'orderNo': 20, 'packet': '18:10:57.368237 IP6 AdipositasThe4th.mdns > ff02::fb.mdns: 0*- [0q] 2/0/0 (Cache flush) PTR AdipositasThe4th.local., (Cache flush) AAAA fe80::42:68ff:fe87:44ed (148)\n'}
{'ID': 123, 'infectedStatus': 'infected', 'orderNo': 23, 'packet': '18:10:57.300554 IP AdipositasThe4th.mdns > 224.0.0.251.mdns: 0*- [0q] 2/0/0 (Cache flush) PTR AdipositasThe4th.local., (Cache flush) AAAA fe80::42:67ff:fe05:6964 (148)\n'}
{'ID': 123, 'infectedStatus': 'healthy', 'orderNo': 21, 'packet': '18:10:57.495311 IP6 AdipositasThe4th > ff02::16: HBH ICMP6, multicast listener report v2, 3 group record(s), length 68\n'}
{'ID': 123, 'infectedStatus': 'infected', 'orderNo': 24, 'packet': '18:10:57.300610 IP6 AdipositasThe4th.mdns > ff02::fb.mdns: 0*- [0q] 2/0/0 (Cache flush) PTR AdipositasThe4th.local., (Cache flush) AAAA fe80::42:67ff:fe05:6964 (148)\n'}
{'ID': 123, 'infectedStatus': 'infected', 'orderNo': 25, 'packet': '18:10:57.573546 IP6 AdipositasThe4th.mdns > ff02::fb.mdns: 0 [10q] PTR (QM)? _nfs._tcp.local. PTR (QM)? _pgpkey-hkp._tcp.local. PTR (QM)? _ipp._tcp.local. PTR (QM)? _ipps._tcp.local. PTR (QM)? _ftp._tcp.local. PTR (QM)? _webdav._tcp.local. PTR (QM)? _webdavs._tcp.local. PTR (QM)? _sftp-ssh._tcp.local. PTR (QM)? _smb._tcp.local. PTR (QM)? _afpovertcp._tcp.local. (159)\n'}
{'ID': 123, 'infectedStatus': 'healthy', 'orderNo': 22, 'packet': '18:10:57.641467 IP6 AdipositasThe4th.mdns > ff02::fb.mdns: 0 [10q] PTR (QM)? _nfs._tcp.local. PTR (QM)? _pgpkey-hkp._tcp.local. PTR (QM)? _ipp._tcp.local. PTR (QM)? _ipps._tcp.local. PTR (QM)? _ftp._tcp.local. PTR (QM)? _webdav._tcp.local. PTR (QM)? _webdavs._tcp.local. PTR (QM)? _sftp-ssh._tcp.local. PTR (QM)? _smb._tcp.local. PTR (QM)? _afpovertcp._tcp.local. (159)\n'}
{'ID': 123, 'infectedStatus': 'healthy', 'orderNo': 23, 'packet': '18:10:58.176279 IP AdipositasThe4th.mdns > 224.0.0.251.mdns: 0*- [0q] 2/0/0 (Cache flush) PTR AdipositasThe4th.local., (Cache flush) A 192.168.128.1 (90)\n'}
{'ID': 123, 'infectedStatus': 'healthy', 'orderNo': 24, 'packet': '18:10:58.443821 IP AdipositasThe4th.mdns > 224.0.0.251.mdns: 0*- [0q] 2/0/0 (Cache flush) PTR AdipositasThe4th.local., (Cache flush) AAAA fe80::42:68ff:fe87:44ed (148)\n'}
